{
  "schema_version": 2,
  "run_id": "20260803-120000-killed_driver",
  "task_type": "embodied",
  "algorithm": {"loss_type": "embodied_sac", "adv_type": null},
  "state": "running",
  "phase": "train",
  "phase_since": "2026-08-03T12:40:00Z",
  "components": {},
  "heartbeat_at": "2026-08-03T12:41:05Z",
  "heartbeat_seq": 488,
  "last_progress_at": "2026-08-03T12:40:00Z",
  "last_metric_at": "2026-08-03T12:40:00Z",
  "progress": {
    "step": 61,
    "max_steps": 400,
    "epoch": 61,
    "step_semantics": "rl_iteration"
  },
  "timing": {
    "started_at": "2026-08-03T12:00:00Z",
    "elapsed_s": 2465.0,
    "step_time_p50": 40.2,
    "step_time_recent": [39.8, 40.6, 40.2],
    "eta_s": 13627.0,
    "eta_confidence": "medium"
  },
  "latest_checkpoint": {
    "step": 60,
    "path": "/logs/killed_driver/checkpoints/global_step_60",
    "saved_at": "2026-08-03T12:39:41Z",
    "size_bytes": 2147483648,
    "resume_dir": "/logs/killed_driver/checkpoints/global_step_60",
    "entry_script": "examples/embodiment/train_async.py",
    "config_name": "maniskill_sac_mlp_async"
  },
  "paths": {
    "tensorboard": "/logs/killed_driver/tensorboard",
    "video_root": "/logs/killed_driver/video"
  },
  "cluster": {"num_nodes": 1, "component_placement": {}},
  "exit": null
}
