{
  "schema_version": 2,
  "run_id": "20260803-090000-sft_qwen",
  "task_type": "sft",
  "algorithm": null,
  "state": "finished",
  "phase": null,
  "phase_since": null,
  "components": {},
  "heartbeat_at": "2026-08-03T11:44:12Z",
  "heartbeat_seq": 4021,
  "last_progress_at": "2026-08-03T11:44:10Z",
  "last_metric_at": "2026-08-03T11:44:11Z",
  "progress": {
    "step": 500,
    "max_steps": 500,
    "epoch": 2,
    "step_semantics": "rl_iteration"
  },
  "timing": {
    "started_at": "2026-08-03T09:00:00Z",
    "elapsed_s": 9852.0,
    "step_time_p50": 19.4,
    "step_time_recent": [19.1, 19.6, 19.4],
    "eta_s": 0.0,
    "eta_confidence": "high"
  },
  "latest_checkpoint": {
    "step": 500,
    "path": "/logs/sft_qwen/checkpoints/global_step_500",
    "saved_at": "2026-08-03T11:44:05Z",
    "size_bytes": 6442450944,
    "resume_dir": "/logs/sft_qwen/checkpoints/global_step_500",
    "entry_script": "examples/sft/main_sft.py",
    "config_name": "qwen2.5_1.5b_sft"
  },
  "paths": {
    "tensorboard": "/logs/sft_qwen/tensorboard",
    "video_root": null
  },
  "cluster": {"num_nodes": 1, "component_placement": {}},
  "exit": null
}
